{
  "$schema": "http://json-schema.org/draft-07/schema#",
  "$id": "brand-tokens-schema",
  "title": "Brand Token Override Schema",
  "description": "Schema for semantic and component-specific brand token overrides",
  "type": "object",
  "required": [
    "$brand"
  ],
  "properties": {
    "$brand": {
      "type": "object",
      "required": [
        "name",
        "description"
      ],
      "properties": {
        "name": {
          "type": "string",
          "description": "Unique identifier for the brand"
        },
        "description": {
          "type": "string",
          "description": "Human-readable brand description"
        },
        "accent": {
          "type": "string",
          "description": "Primary accent color palette (e.g., 'red', 'blue', 'green')"
        }
      }
    },
    "color": {
      "type": "object",
      "description": "Color token overrides"
    },
    "typography": {
      "type": "object",
      "description": "Typography token overrides"
    },
    "spacing": {
      "type": "object",
      "description": "Spacing token overrides"
    },
    "shape": {
      "type": "object",
      "description": "Shape/radius token overrides"
    },
    "motion": {
      "type": "object",
      "description": "Motion/animation token overrides"
    },
    "components": {
      "type": "object",
      "description": "Component overrides keyed by current PascalCase contract name, then the token suffix without repeating the component prefix. For example, components.CodeBlock.design.root.shape.radius addresses --fsds-code-block-design-root-shape-radius. Values must reach a consumed Web component token or design slot; generate:check rejects unknown and unconsumed destinations. The brand layer emits namespaced values at the brand scope for detached parts and on component roots to override local defaults. The Default brand also applies when data-brand is absent. Use top-level semantic groups for decisions shared across components. Consumer unlayered CSS or inline component overrides can supersede the brand."
    }
  }
}
