{
  "$brand": {
    "name": "ocean",
    "description": "Cyan/teal brand theme - calm, refreshing, airy. Cyan is the signature accent for brightness; teal provides depth and borders. Layered sea palette: light cyan/teal tints for airy surfaces, deep ocean tones for text.",
    "accent": "cyan",
    "density": "spacious"
  },
  "color": {
    "foreground": {
      "accent": {
        "$type": "color",
        "$value": "{color.palette.cyan.500}",
        "$extensions": {
          "fsds.light": "{color.palette.cyan.600}",
          "fsds.dark": "{color.palette.cyan.400}"
        },
        "$description": "Cyan accent foreground - brighter aquatic signature; 600 in light for stronger contrast on white bg"
      },
      "link": {
        "$type": "color",
        "$value": "{color.palette.cyan.600}",
        "$extensions": {
          "fsds.light": "{color.palette.cyan.600}",
          "fsds.dark": "{color.palette.cyan.300}"
        },
        "$description": "Cyan link — deeper stop in light for legibility, lighter in dark"
      },
      "linkHover": {
        "$type": "color",
        "$value": "{color.palette.cyan.700}",
        "$extensions": {
          "fsds.light": "{color.palette.cyan.700}",
          "fsds.dark": "{color.palette.cyan.200}"
        },
        "$description": "Hover deepens into ocean teal territory"
      },
      "linkVisited": {
        "$type": "color",
        "$value": "{color.palette.teal.500}",
        "$extensions": {
          "fsds.light": "{color.palette.teal.500}",
          "fsds.dark": "{color.palette.teal.400}"
        },
        "$description": "Visited links shift to teal for a distinct but harmonious signal"
      },
      "highlight": {
        "$type": "color",
        "$value": "{color.palette.cyan.800}",
        "$extensions": {
          "fsds.light": "{color.palette.cyan.800}",
          "fsds.dark": "{color.palette.cyan.200}"
        },
        "$description": "Deep ocean cyan for highlighted text in light; airy light tint in dark"
      }
    },
    "background": {
      "accent": {
        "$type": "color",
        "$value": "{color.palette.cyan.500}",
        "$extensions": {
          "fsds.light": "{color.palette.cyan.500}",
          "fsds.dark": "{color.palette.cyan.500}"
        },
        "$description": "Cyan 500 fill — white text contrast ~4.86:1 in both modes, AA-safe"
      },
      "highlight": {
        "$type": "color",
        "$value": "{color.palette.cyan.100}",
        "$extensions": {
          "fsds.light": "{color.palette.cyan.100}",
          "fsds.dark": "{color.palette.cyan.800}"
        },
        "$description": "Airy cyan tint for highlight washes; deep ocean cyan in dark"
      },
      "info": {
        "softer": {
          "$type": "color",
          "$value": "{color.palette.cyan.50}",
          "$extensions": {
            "fsds.light": "{color.palette.cyan.50}",
            "fsds.dark": "{color.palette.cyan.900}"
          },
          "$description": "Ocean brand re-grounds info softer wash to cyan palette"
        }
      },
      "success": {
        "softer": {
          "$type": "color",
          "$value": "{color.palette.teal.50}",
          "$extensions": {
            "fsds.light": "{color.palette.teal.50}",
            "fsds.dark": "{color.palette.teal.900}"
          },
          "$description": "Success softer wash in teal — sea-green depth"
        }
      }
    },
    "border": {
      "accent": {
        "$type": "color",
        "$value": "{color.palette.cyan.500}",
        "$extensions": {
          "fsds.light": "{color.palette.cyan.500}",
          "fsds.dark": "{color.palette.cyan.400}"
        },
        "$description": "Cyan accent border — brighter aquatic line"
      },
      "default": {
        "$type": "color",
        "$value": "{color.palette.teal.200}",
        "$extensions": {
          "fsds.light": "{color.palette.teal.200}",
          "fsds.dark": "{color.palette.teal.700}"
        },
        "$description": "Default border — gentle teal for structural depth, not aggressive neutral"
      },
      "hover": {
        "$type": "color",
        "$value": "{color.palette.cyan.400}",
        "$extensions": {
          "fsds.light": "{color.palette.cyan.400}",
          "fsds.dark": "{color.palette.cyan.400}"
        },
        "$description": "Hover brightens into cyan"
      },
      "focus": {
        "$type": "color",
        "$value": "{color.palette.cyan.500}",
        "$extensions": {
          "fsds.light": "{color.palette.cyan.500}",
          "fsds.dark": "{color.palette.cyan.400}"
        },
        "$description": "Focus ring — full cyan signal"
      },
      "light": {
        "$type": "color",
        "$value": "{color.palette.cyan.100}",
        "$extensions": {
          "fsds.light": "{color.palette.cyan.100}",
          "fsds.dark": "{color.palette.cyan.800}"
        },
        "$description": "Light border — barely-there aqua tint"
      },
      "primary": {
        "$type": "color",
        "$value": "{color.palette.teal.300}",
        "$extensions": {
          "fsds.light": "{color.palette.teal.300}",
          "fsds.dark": "{color.palette.teal.600}"
        },
        "$description": "Primary structural border — teal mid-depth for layered sea effect"
      }
    },
    "navigation": {
      "foreground": {
        "active": {
          "$type": "color",
          "$value": "{color.palette.cyan.600}",
          "$extensions": {
            "fsds.light": "{color.palette.cyan.600}",
            "fsds.dark": "{color.palette.cyan.300}"
          },
          "$description": "Active nav item — deeper cyan in light for legibility"
        }
      },
      "background": {
        "hover": {
          "$type": "color",
          "$value": "{color.palette.cyan.50}",
          "$extensions": {
            "fsds.light": "{color.palette.cyan.50}",
            "fsds.dark": "{color.palette.cyan.900}"
          },
          "$description": "Nav hover wash — airy cyan surface tint"
        },
        "active": {
          "$type": "color",
          "$value": "{color.palette.cyan.100}",
          "$extensions": {
            "fsds.light": "{color.palette.cyan.100}",
            "fsds.dark": "{color.palette.cyan.800}"
          },
          "$description": "Active nav item background — gentle cyan tint"
        }
      },
      "stateLayer": {
        "hover": {
          "$type": "number",
          "$value": "{interaction.stateLayer.hover}",
          "$description": "Nav hover state-layer opacity — Material-style tonal overlay"
        },
        "selected": {
          "$type": "number",
          "$value": "{interaction.stateLayer.selected}",
          "$description": "Nav selected/active state-layer opacity"
        },
        "pressed": {
          "$type": "number",
          "$value": "{interaction.stateLayer.pressed}",
          "$description": "Nav pressed state-layer opacity"
        }
      }
    },
    "action": {
      "background": {
        "primary": {
          "default": {
            "$type": "color",
            "$value": "{color.palette.cyan.500}",
            "$description": "Primary action fill — cyan 500, white text contrast ~4.86:1 AA"
          },
          "hover": {
            "$type": "color",
            "$value": "{color.palette.cyan.600}",
            "$description": "Hover deepens to cyan 600 — contrast ~6.77:1, well above AA"
          },
          "active": {
            "$type": "color",
            "$value": "{color.palette.cyan.700}",
            "$description": "Active/pressed state — deep ocean cyan"
          }
        }
      },
      "border": {
        "primary": {
          "default": {
            "$type": "color",
            "$value": "{color.palette.cyan.500}",
            "$description": "Primary action border — cyan accent"
          },
          "focus": {
            "$type": "color",
            "$value": "{color.palette.cyan.300}",
            "$description": "Focus ring on action — lighter cyan for offset glow"
          }
        }
      }
    },
    "status": {
      "highlight": {
        "$type": "color",
        "$value": "{color.palette.cyan.500}",
        "$extensions": {
          "fsds.light": "{color.palette.cyan.500}",
          "fsds.dark": "{color.palette.cyan.400}"
        },
        "$description": "Status highlight — cyan signal, sea-bright"
      }
    }
  },
  "shape": {
    "control": {
      "radius": {
        "default": {
          "$type": "dimension",
          "$value": "{shape.radius.04}",
          "$description": "Generous control radius (16px) — airy, rounded, calm"
        }
      }
    },
    "card": {
      "radius": {
        "$type": "dimension",
        "$value": "{shape.radius.05}",
        "$description": "Card border radius (32px) — very fluid, spacious, refreshing"
      },
      "border": {
        "light": {
          "$type": "color",
          "$value": "{color.palette.cyan.100}",
          "$extensions": {
            "fsds.light": "{color.palette.cyan.100}",
            "fsds.dark": "{color.palette.cyan.800}"
          },
          "$description": "Light card border — barely-there aqua tint"
        },
        "medium": {
          "$type": "color",
          "$value": "{color.palette.teal.200}",
          "$extensions": {
            "fsds.light": "{color.palette.teal.200}",
            "fsds.dark": "{color.palette.teal.700}"
          },
          "$description": "Medium card border — teal depth layer"
        },
        "dark": {
          "$type": "color",
          "$value": "{color.palette.teal.400}",
          "$extensions": {
            "fsds.light": "{color.palette.teal.400}",
            "fsds.dark": "{color.palette.teal.500}"
          },
          "$description": "Dark card border — visible teal sea-depth"
        },
        "transparent": {
          "$type": "color",
          "$value": "{color.mode.transparent}",
          "$extensions": {